{
  "report_id": "11111111-1111-4111-8111-111111111108",
  "schema_version": "1.0",
  "scan_type": "message",
  "created_at": "2026-10-22T12:00:00Z",
  "input": {
    "display_value": "Delivery update: Your package from Bookstore is arriving today. Details at http://bit.ly/track-pkg",
    "normalized_value": "Delivery update: Your package from Bookstore is arriving today. Details at http://bit.ly/track-pkg",
    "input_hash": "c72ac3bfb9b4e99b3d02eac3d17c0aaf8c9691a7700bdbcfabf600f507bdf012",
    "input_length": 98
  },
  "assessment": {
    "risk_score": 20,
    "risk_level": "low",
    "confidence": "medium",
    "verdict_label": "Low risk indicators found",
    "limitations": [
      "No strong indicators were found by CIPHER AI. This does not guarantee that the content is safe.",
      "The destination page was not fetched or inspected.",
      "No reputation databases were consulted.",
      "Results are based purely on offline lexical, syntactic, and structural heuristics."
    ]
  },
  "indicators": [
    {
      "indicator_id": "MSG_EMBEDDED_SHORT_LINK",
      "category": "redirect_shortener",
      "evidence_kind": "observed",
      "title": "Message Contains Shortened URL",
      "description": "Message incorporates a shortened link hiding the real target destination.",
      "observed_value": "Shortener: 'bit.ly'",
      "severity": "medium",
      "triggered": true
    }
  ],
  "score_breakdown": [
    {
      "indicator_id": "MSG_EMBEDDED_SHORT_LINK",
      "points": 20,
      "reason": "Message Contains Shortened URL detected in input (+20 pts).",
      "evidence_kind": "observed",
      "capped": false
    }
  ],
  "external_evidence": [],
  "ai_explanation": {
    "summary": "CIPHER AI detected only low-weight baseline heuristics resulting in a risk score of 20/100. No strong known threat signatures were observed during offline lexical analysis.",
    "key_findings": [
      {
        "text": "Message Contains Shortened URL (Severity.MEDIUM severity finding).",
        "indicator_ids": [
          "MSG_EMBEDDED_SHORT_LINK"
        ]
      }
    ],
    "user_guidance": "No urgent threat detected, but standard digital security vigilance should always be maintained.",
    "uncertainty_notes": "Analysis was conducted offline without destination network fetching or real-time reputation database lookups. Novel zero-day campaigns or benign internal resources may not be fully represented.",
    "generated_by": "deterministic_fallback",
    "model": null,
    "validated": true
  },
  "recommended_actions": [
    {
      "action_id": "ACT_EXERCISE_CAUTION",
      "priority": 1,
      "text": "Continue to exercise standard digital caution. Absence of strong findings does not guarantee safety.",
      "applies_to_levels": [
        "low",
        "inconclusive"
      ]
    }
  ],
  "engine_version": "1.0.0",
  "processing": {
    "duration_ms": 15,
    "ai_status": "disabled",
    "external_lookup_status": "not_attempted"
  },
  "scan_id": null,
  "persistence_status": "not_saved_guest",
  "saved_at": null,
  "reputation_results": null,
  "email_summary": null,
  "extracted_urls": null,
  "attachments": null
}