{
  "report_id": "11111111-1111-4111-8111-111111111102",
  "schema_version": "1.0",
  "scan_type": "url",
  "created_at": "2026-10-22T12:00:00Z",
  "input": {
    "display_value": "hxxps://bit[.]ly/annual-charity-report-example",
    "normalized_value": "https://bit.ly/annual-charity-report-example",
    "input_hash": "12618f571362535d57ca027fa5df778439eef879abdffbbcaa6c9a4aca6f8474",
    "input_length": 44
  },
  "assessment": {
    "risk_score": 20,
    "risk_level": "low",
    "confidence": "medium",
    "verdict_label": "Low risk indicators found",
    "limitations": [
      "No strong indicators were found by CIPHER AI. This does not guarantee that the content is safe.",
      "The destination page was not fetched or inspected.",
      "No reputation databases were consulted.",
      "Results are based purely on offline lexical, syntactic, and structural heuristics."
    ]
  },
  "indicators": [
    {
      "indicator_id": "URL_SHORTENER_DOMAIN",
      "category": "redirect_shortener",
      "evidence_kind": "observed",
      "title": "URL Shortening Service Detected",
      "description": "The domain belongs to a public URL shortening service that conceals the true landing page.",
      "observed_value": "bit.ly",
      "severity": "medium",
      "triggered": true
    }
  ],
  "score_breakdown": [
    {
      "indicator_id": "URL_SHORTENER_DOMAIN",
      "points": 20,
      "reason": "URL Shortening Service Detected detected in input (+20 pts).",
      "evidence_kind": "observed",
      "capped": false
    }
  ],
  "external_evidence": [],
  "ai_explanation": {
    "summary": "CIPHER AI detected only low-weight baseline heuristics resulting in a risk score of 20/100. No strong known threat signatures were observed during offline lexical analysis.",
    "key_findings": [
      {
        "text": "URL Shortening Service Detected (Severity.MEDIUM severity finding).",
        "indicator_ids": [
          "URL_SHORTENER_DOMAIN"
        ]
      }
    ],
    "user_guidance": "No urgent threat detected, but standard digital security vigilance should always be maintained.",
    "uncertainty_notes": "Analysis was conducted offline without destination network fetching or real-time reputation database lookups. Novel zero-day campaigns or benign internal resources may not be fully represented.",
    "generated_by": "deterministic_fallback",
    "model": null,
    "validated": true
  },
  "recommended_actions": [
    {
      "action_id": "ACT_EXERCISE_CAUTION",
      "priority": 1,
      "text": "Continue to exercise standard digital caution. Absence of strong findings does not guarantee safety.",
      "applies_to_levels": [
        "low",
        "inconclusive"
      ]
    }
  ],
  "engine_version": "1.0.0",
  "processing": {
    "duration_ms": 12,
    "ai_status": "disabled",
    "external_lookup_status": "not_attempted"
  },
  "scan_id": null,
  "persistence_status": "not_saved_guest",
  "saved_at": null,
  "reputation_results": null,
  "email_summary": null,
  "extracted_urls": null,
  "attachments": null
}