{
  "report_id": "11111111-1111-4111-8111-111111111107",
  "schema_version": "1.0",
  "scan_type": "message",
  "created_at": "2026-10-22T12:00:00Z",
  "input": {
    "display_value": "Reminder: The neighborhood community garden meeting is scheduled for Saturday at 10 AM.",
    "normalized_value": "Reminder: The neighborhood community garden meeting is scheduled for Saturday at 10 AM.",
    "input_hash": "49d9cef6dea0f40891d03fe5ca68d704545de94ca8ee616eb1d50e4f4630a420",
    "input_length": 87
  },
  "assessment": {
    "risk_score": 0,
    "risk_level": "low",
    "confidence": "low",
    "verdict_label": "Low risk indicators found",
    "limitations": [
      "No strong indicators were found by CIPHER AI. This does not guarantee that the content is safe.",
      "The destination page was not fetched or inspected.",
      "No reputation databases were consulted.",
      "Results are based purely on offline lexical, syntactic, and structural heuristics."
    ]
  },
  "indicators": [],
  "score_breakdown": [],
  "external_evidence": [],
  "ai_explanation": {
    "summary": "CIPHER AI detected only low-weight baseline heuristics resulting in a risk score of 0/100. No strong known threat signatures were observed during offline lexical analysis.",
    "key_findings": [],
    "user_guidance": "No urgent threat detected, but standard digital security vigilance should always be maintained.",
    "uncertainty_notes": "Analysis was conducted offline without destination network fetching or real-time reputation database lookups. Novel zero-day campaigns or benign internal resources may not be fully represented.",
    "generated_by": "deterministic_fallback",
    "model": null,
    "validated": true
  },
  "recommended_actions": [
    {
      "action_id": "ACT_EXERCISE_CAUTION",
      "priority": 1,
      "text": "Continue to exercise standard digital caution. Absence of strong findings does not guarantee safety.",
      "applies_to_levels": [
        "low",
        "inconclusive"
      ]
    }
  ],
  "engine_version": "1.0.0",
  "processing": {
    "duration_ms": 15,
    "ai_status": "disabled",
    "external_lookup_status": "not_attempted"
  },
  "scan_id": null,
  "persistence_status": "not_saved_guest",
  "saved_at": null,
  "reputation_results": null,
  "email_summary": null,
  "extracted_urls": null,
  "attachments": null
}