{
  "report_id": "11111111-1111-4111-8111-111111111106",
  "schema_version": "1.0",
  "scan_type": "url",
  "created_at": "2026-10-22T12:00:00Z",
  "input": {
    "display_value": "hxxp://chase-security[.]online-banking[.]example[.]invalid/login",
    "normalized_value": "http://chase-security.online-banking.example.invalid/login",
    "input_hash": "b0a4300d4d73b151c9d12a3b98723580e5de94ccddaa7e0a4bb208fe516ad228",
    "input_length": 58
  },
  "assessment": {
    "risk_score": 35,
    "risk_level": "medium",
    "confidence": "medium",
    "verdict_label": "Suspicious patterns detected",
    "limitations": [
      "The destination page was not fetched or inspected.",
      "No reputation databases were consulted.",
      "Results are based purely on offline lexical, syntactic, and structural heuristics."
    ]
  },
  "indicators": [
    {
      "indicator_id": "URL_CREDENTIAL_PATH_KEYWORD",
      "category": "credential_lure",
      "evidence_kind": "inferred",
      "title": "Credential Keywords in Path",
      "description": "URL path targets sensitive authentication or account-recovery workflows (e.g., /login, /verify, /banking).",
      "observed_value": "login",
      "severity": "high",
      "triggered": true
    },
    {
      "indicator_id": "URL_NO_HTTPS",
      "category": "url_structure",
      "evidence_kind": "observed",
      "title": "Insecure Plaintext HTTP Scheme",
      "description": "URL uses unencrypted plaintext HTTP rather than HTTPS.",
      "observed_value": "http://",
      "severity": "low",
      "triggered": true
    }
  ],
  "score_breakdown": [
    {
      "indicator_id": "URL_NO_HTTPS",
      "points": 10,
      "reason": "Insecure Plaintext HTTP Scheme detected in input (+10 pts).",
      "evidence_kind": "observed",
      "capped": false
    },
    {
      "indicator_id": "URL_CREDENTIAL_PATH_KEYWORD",
      "points": 25,
      "reason": "Credential Keywords in Path detected in input (+25 pts).",
      "evidence_kind": "inferred",
      "capped": false
    }
  ],
  "external_evidence": [],
  "ai_explanation": {
    "summary": "CIPHER AI noted suspicious patterns yielding a moderate risk score of 35/100. Anomalies were detected that warrant verification before trusting the asset.",
    "key_findings": [
      {
        "text": "Credential Keywords in Path (Severity.HIGH severity finding).",
        "indicator_ids": [
          "URL_CREDENTIAL_PATH_KEYWORD"
        ]
      },
      {
        "text": "Insecure Plaintext HTTP Scheme (Severity.LOW severity finding).",
        "indicator_ids": [
          "URL_NO_HTTPS"
        ]
      }
    ],
    "user_guidance": "Proceed with caution. Check domain registrations and sender authenticity through official channels.",
    "uncertainty_notes": "Analysis was conducted offline without destination network fetching or real-time reputation database lookups. Novel zero-day campaigns or benign internal resources may not be fully represented.",
    "generated_by": "deterministic_fallback",
    "model": null,
    "validated": true
  },
  "recommended_actions": [
    {
      "action_id": "ACT_VERIFY_OFFICIAL_CHANNEL",
      "priority": 2,
      "text": "Independently verify the communication using official contact details retrieved from a trusted bookmark or statement.",
      "applies_to_levels": [
        "medium",
        "high",
        "critical",
        "inconclusive"
      ]
    },
    {
      "action_id": "ACT_REPORT_PHISHING",
      "priority": 5,
      "text": "Report the suspicious message or URL to your email/messaging provider and internal security department.",
      "applies_to_levels": [
        "medium",
        "high",
        "critical"
      ]
    }
  ],
  "engine_version": "1.0.0",
  "processing": {
    "duration_ms": 12,
    "ai_status": "disabled",
    "external_lookup_status": "not_attempted"
  }
}