{
  "report_id": "11111111-1111-4111-8111-111111111109",
  "schema_version": "1.0",
  "scan_type": "message",
  "created_at": "2026-10-22T12:00:00Z",
  "input": {
    "display_value": "Google Security Alert: An unrecognized device logged into your account. Reply with your 6-digit verification code to confirm.",
    "normalized_value": "Google Security Alert: An unrecognized device logged into your account. Reply with your 6-digit verification code to confirm.",
    "input_hash": "426594002291fa470b6d199b391ce4339e3625105b21281689a87527acded13f",
    "input_length": 125
  },
  "assessment": {
    "risk_score": 70,
    "risk_level": "high",
    "confidence": "high",
    "verdict_label": "High risk indicators identified",
    "limitations": [
      "The destination page was not fetched or inspected.",
      "No reputation databases were consulted.",
      "Results are based purely on offline lexical, syntactic, and structural heuristics."
    ]
  },
  "indicators": [
    {
      "indicator_id": "MSG_OTP_PIN_REQUEST",
      "category": "credential_lure",
      "evidence_kind": "observed",
      "title": "Request for Two-Factor OTP or SMS Code",
      "description": "Message attempts to intercept two-factor authentication codes, one-time passwords, or security PINs.",
      "observed_value": "OTP lure: 'verification code'",
      "severity": "critical",
      "triggered": true
    },
    {
      "indicator_id": "MSG_TECH_SUPPORT_IMPERSONATION",
      "category": "impersonation",
      "evidence_kind": "inferred",
      "title": "Tech Support or Virus Alert",
      "description": "Message warns of viral infection, compromised device, or unauthorized login to induce urgent support contact.",
      "observed_value": "Tech alert: 'device logged into your account'",
      "severity": "high",
      "triggered": true
    }
  ],
  "score_breakdown": [
    {
      "indicator_id": "MSG_OTP_PIN_REQUEST",
      "points": 40,
      "reason": "Request for Two-Factor OTP or SMS Code detected in input (+40 pts).",
      "evidence_kind": "observed",
      "capped": false
    },
    {
      "indicator_id": "MSG_TECH_SUPPORT_IMPERSONATION",
      "points": 30,
      "reason": "Tech Support or Virus Alert detected in input (+30 pts).",
      "evidence_kind": "inferred",
      "capped": false
    }
  ],
  "external_evidence": [],
  "ai_explanation": {
    "summary": "CIPHER AI detected high-risk deceptive patterns resulting in a risk score of 70/100. Multiple corroborated structural or lexical indicators suggest an intentional threat.",
    "key_findings": [
      {
        "text": "Request for Two-Factor OTP or SMS Code (Severity.CRITICAL severity finding).",
        "indicator_ids": [
          "MSG_OTP_PIN_REQUEST"
        ]
      },
      {
        "text": "Tech Support or Virus Alert (Severity.HIGH severity finding).",
        "indicator_ids": [
          "MSG_TECH_SUPPORT_IMPERSONATION"
        ]
      }
    ],
    "user_guidance": "Exercise extreme caution. Verify the communication independently before taking any requested action.",
    "uncertainty_notes": "Analysis was conducted offline without destination network fetching or real-time reputation database lookups. Novel zero-day campaigns or benign internal resources may not be fully represented.",
    "generated_by": "deterministic_fallback",
    "model": null,
    "validated": true
  },
  "recommended_actions": [
    {
      "action_id": "ACT_DO_NOT_REPLY_OR_SHARE",
      "priority": 1,
      "text": "Do not reply to this message, and never disclose or forward passwords, OTPs, or security PINs.",
      "applies_to_levels": [
        "high",
        "critical"
      ]
    },
    {
      "action_id": "ACT_VERIFY_OFFICIAL_CHANNEL",
      "priority": 2,
      "text": "Independently verify the communication using official contact details retrieved from a trusted bookmark or statement.",
      "applies_to_levels": [
        "medium",
        "high",
        "critical",
        "inconclusive"
      ]
    },
    {
      "action_id": "ACT_CHANGE_PASSWORDS",
      "priority": 3,
      "text": "If credentials were submitted, immediately reset your password and enable multi-factor authentication from a secure device.",
      "applies_to_levels": [
        "high",
        "critical"
      ]
    },
    {
      "action_id": "ACT_REPORT_PHISHING",
      "priority": 5,
      "text": "Report the suspicious message or URL to your email/messaging provider and internal security department.",
      "applies_to_levels": [
        "medium",
        "high",
        "critical"
      ]
    }
  ],
  "engine_version": "1.0.0",
  "processing": {
    "duration_ms": 15,
    "ai_status": "disabled",
    "external_lookup_status": "not_attempted"
  },
  "scan_id": null,
  "persistence_status": "not_saved_guest",
  "saved_at": null,
  "reputation_results": null,
  "email_summary": null,
  "extracted_urls": null,
  "attachments": null
}