{
  "report_id": "11111111-1111-4111-8111-111111111104",
  "schema_version": "1.0",
  "scan_type": "url",
  "created_at": "2026-10-22T12:00:00Z",
  "input": {
    "display_value": "hxxp://192[.]0[.]2[.]14:8080/secure/login/verify.php",
    "normalized_value": "http://192.0.2.14:8080/secure/login/verify.php",
    "input_hash": "3def19678eaa05ee3c879b6ef896f3626bb3de1b4b37864775c89cdf75906239",
    "input_length": 46
  },
  "assessment": {
    "risk_score": 85,
    "risk_level": "critical",
    "confidence": "high",
    "verdict_label": "Critical threat indicators identified",
    "limitations": [
      "The destination page was not fetched or inspected.",
      "No reputation databases were consulted.",
      "Results are based purely on offline lexical, syntactic, and structural heuristics."
    ]
  },
  "indicators": [
    {
      "indicator_id": "URL_IP_HOST",
      "category": "domain",
      "evidence_kind": "observed",
      "title": "IP Address Used as Hostname",
      "description": "The URL authority uses a raw IPv4 or IPv6 address instead of a standard registered domain.",
      "observed_value": "192.0.2.14",
      "severity": "high",
      "triggered": true
    },
    {
      "indicator_id": "URL_CREDENTIAL_PATH_KEYWORD",
      "category": "credential_lure",
      "evidence_kind": "inferred",
      "title": "Credential Keywords in Path",
      "description": "URL path targets sensitive authentication or account-recovery workflows (e.g., /login, /verify, /banking).",
      "observed_value": "verify",
      "severity": "high",
      "triggered": true
    },
    {
      "indicator_id": "URL_NON_STANDARD_PORT",
      "category": "url_structure",
      "evidence_kind": "observed",
      "title": "Non-Standard Network Port",
      "description": "The URL explicitly targets a port other than standard web ports (80, 443, 8080, 8443).",
      "observed_value": "Port 8080",
      "severity": "medium",
      "triggered": true
    },
    {
      "indicator_id": "URL_NO_HTTPS",
      "category": "url_structure",
      "evidence_kind": "observed",
      "title": "Insecure Plaintext HTTP Scheme",
      "description": "URL uses unencrypted plaintext HTTP rather than HTTPS.",
      "observed_value": "http://",
      "severity": "low",
      "triggered": true
    }
  ],
  "score_breakdown": [
    {
      "indicator_id": "URL_NON_STANDARD_PORT",
      "points": 15,
      "reason": "Non-Standard Network Port detected in input (+15 pts).",
      "evidence_kind": "observed",
      "capped": false
    },
    {
      "indicator_id": "URL_NO_HTTPS",
      "points": 10,
      "reason": "Insecure Plaintext HTTP Scheme detected in input (+10 pts).",
      "evidence_kind": "observed",
      "capped": false
    },
    {
      "indicator_id": "URL_IP_HOST",
      "points": 35,
      "reason": "IP Address Used as Hostname detected in input (+35 pts).",
      "evidence_kind": "observed",
      "capped": false
    },
    {
      "indicator_id": "URL_CREDENTIAL_PATH_KEYWORD",
      "points": 25,
      "reason": "Credential Keywords in Path detected in input (+25 pts).",
      "evidence_kind": "inferred",
      "capped": false
    }
  ],
  "external_evidence": [],
  "ai_explanation": {
    "summary": "CIPHER AI identified critical threat indicators with an aggregated risk score of 85/100. The asset exhibits severe markers characteristic of active credential phishing or direct scam operations.",
    "key_findings": [
      {
        "text": "IP Address Used as Hostname (Severity.HIGH severity finding).",
        "indicator_ids": [
          "URL_IP_HOST"
        ]
      },
      {
        "text": "Credential Keywords in Path (Severity.HIGH severity finding).",
        "indicator_ids": [
          "URL_CREDENTIAL_PATH_KEYWORD"
        ]
      },
      {
        "text": "Non-Standard Network Port (Severity.MEDIUM severity finding).",
        "indicator_ids": [
          "URL_NON_STANDARD_PORT"
        ]
      },
      {
        "text": "Insecure Plaintext HTTP Scheme (Severity.LOW severity finding).",
        "indicator_ids": [
          "URL_NO_HTTPS"
        ]
      }
    ],
    "user_guidance": "Treat this asset as hostile. Do not interact, provide credentials, or follow external links.",
    "uncertainty_notes": "Analysis was conducted offline without destination network fetching or real-time reputation database lookups. Novel zero-day campaigns or benign internal resources may not be fully represented.",
    "generated_by": "deterministic_fallback",
    "model": null,
    "validated": true
  },
  "recommended_actions": [
    {
      "action_id": "ACT_DO_NOT_CLICK",
      "priority": 1,
      "text": "Do not click, navigate to, or open this link under any circumstances.",
      "applies_to_levels": [
        "high",
        "critical"
      ]
    },
    {
      "action_id": "ACT_VERIFY_OFFICIAL_CHANNEL",
      "priority": 2,
      "text": "Independently verify the communication using official contact details retrieved from a trusted bookmark or statement.",
      "applies_to_levels": [
        "medium",
        "high",
        "critical",
        "inconclusive"
      ]
    },
    {
      "action_id": "ACT_CHANGE_PASSWORDS",
      "priority": 3,
      "text": "If credentials were submitted, immediately reset your password and enable multi-factor authentication from a secure device.",
      "applies_to_levels": [
        "high",
        "critical"
      ]
    },
    {
      "action_id": "ACT_CONTACT_BANK",
      "priority": 4,
      "text": "If financial information or card numbers were shared, contact your bank immediately to block unauthorized transactions.",
      "applies_to_levels": [
        "critical"
      ]
    },
    {
      "action_id": "ACT_REPORT_PHISHING",
      "priority": 5,
      "text": "Report the suspicious message or URL to your email/messaging provider and internal security department.",
      "applies_to_levels": [
        "medium",
        "high",
        "critical"
      ]
    }
  ],
  "engine_version": "1.0.0",
  "processing": {
    "duration_ms": 12,
    "ai_status": "disabled",
    "external_lookup_status": "not_attempted"
  }
}