{
  "report_id": "11111111-1111-4111-8111-111111111111",
  "schema_version": "1.0",
  "scan_type": "message",
  "created_at": "2026-10-22T12:00:00Z",
  "input": {
    "display_value": "Hi",
    "normalized_value": "Hi",
    "input_hash": "3639efcd08abb273b1619e82e78c29a7df02c1051b1820e99fc395dcaa3326b8",
    "input_length": 2
  },
  "assessment": {
    "risk_score": 0,
    "risk_level": "inconclusive",
    "confidence": "low",
    "verdict_label": "Evaluation inconclusive",
    "limitations": [
      "Input length is insufficient for meaningful threat pattern analysis."
    ]
  },
  "indicators": [],
  "score_breakdown": [],
  "external_evidence": [],
  "ai_explanation": {
    "summary": "CIPHER AI reached an inconclusive evaluation due to insufficient observable context or unparsable input formatting.",
    "key_findings": [],
    "user_guidance": "Do not assume safety. Verify the asset through independent authoritative channels.",
    "uncertainty_notes": "Analysis was conducted offline without destination network fetching or real-time reputation database lookups. Novel zero-day campaigns or benign internal resources may not be fully represented.",
    "generated_by": "deterministic_fallback",
    "model": null,
    "validated": true
  },
  "recommended_actions": [
    {
      "action_id": "ACT_EXERCISE_CAUTION",
      "priority": 1,
      "text": "Continue to exercise standard digital caution. Absence of strong findings does not guarantee safety.",
      "applies_to_levels": [
        "low",
        "inconclusive"
      ]
    },
    {
      "action_id": "ACT_VERIFY_OFFICIAL_CHANNEL",
      "priority": 2,
      "text": "Independently verify the communication using official contact details retrieved from a trusted bookmark or statement.",
      "applies_to_levels": [
        "medium",
        "high",
        "critical",
        "inconclusive"
      ]
    }
  ],
  "engine_version": "1.0.0",
  "processing": {
    "duration_ms": 15,
    "ai_status": "disabled",
    "external_lookup_status": "not_attempted"
  }
}